<?xml version="1.0" encoding="UTF-8" ?>
<!DOCTYPE testsuite SYSTEM "file:///home/rb432/workspace/rte/dtd/testsuite.dtd">

<testsuite id="6.3" name="measure phrases">

<testcase id="3.242">
  <proposition id="3.242.1">
    <rmrsbankitem id="164">The PC-6082 is faster than 500 MIPS.</rmrsbankitem>
  </proposition>
  <proposition id="3.242.2">
    <rmrsbankitem id="165">The ITEL-ZX is slower than 500 MIPS.</rmrsbankitem>
  </proposition>
  <proposition id="3.242.3">
    <rmrsbankitem id="166">Is the PC-6082 faster than the ITEL-ZX?</rmrsbankitem>
  </proposition>
  <valid id="3.242.a">
    <theory> <ref src="3.242.1"/> <ref src="3.242.2"/> </theory>
    <conclusion> <ref src="3.242.3"/> </conclusion>
  </valid>
</testcase>

</testsuite>