<?xml version="1.0" encoding="UTF-8" ?>
<!DOCTYPE testsuite SYSTEM "file:///home/rb432/workspace/rte/dtd/testsuite.dtd">

<testsuite id="6.4" name="differential comparatives">

<testcase id="3.243">
  <proposition id="3.243.1">
    <rmrsbankitem id="167">ITEL sold 3000 more computers than APCOM.</rmrsbankitem>
  </proposition>
  <proposition id="3.243.2">
    <rmrsbankitem id="61">APCOM sold exactly 2500 computers.</rmrsbankitem>
  </proposition>
  <proposition id="3.243.3">
    <rmrsbankitem id="62">Did ITEL sell 5500 computers?</rmrsbankitem>
  </proposition>
  <valid id="3.243.a">
    <theory> <ref src="3.243.1"/> <ref src="3.243.2"/> </theory>
    <conclusion> <ref src="3.243.3"/> </conclusion>
  </valid>
</testcase>

</testsuite>