<?xml version="1.0" encoding="UTF-8" ?>
<!DOCTYPE testsuite SYSTEM "file:///home/rb432/workspace/rte/dtd/testsuite.dtd">

<testsuite id="2.6" name="collective and distributive plurals">

<testcase id="3.111">
  <proposition id="3.111.1">
    <rmrsbankitem id="6">Smith signed one contract.</rmrsbankitem>
  </proposition>
  <proposition id="3.111.2">
    <rmrsbankitem id="7">Jones signed another contract.</rmrsbankitem>
  </proposition>
  <proposition id="3.111.3">
    <rmrsbankitem id="151">Did Smith and Jones sign two contracts?</rmrsbankitem>
  </proposition>
  <valid id="3.111.a">
    <theory> <ref src="3.111.1"/> <ref src="3.111.2"/> </theory>
    <conclusion> <ref src="3.111.3"/> </conclusion>
  </valid>
</testcase>

<testcase id="3.112">
  <proposition id="3.112.1">
    <rmrsbankitem id="8">Smith signed two contracts.</rmrsbankitem>
  </proposition>
  <proposition id="3.112.2">
    <rmrsbankitem id="9">Jones signed two contracts.</rmrsbankitem>
  </proposition>
  <proposition id="3.112.3">
    <rmrsbankitem id="151">Did Smith and Jones sign two contracts?</rmrsbankitem>
  </proposition>
  <valid id="3.112.a">
    <theory> <ref src="3.112.1"/> <ref src="3.112.2"/> </theory>
    <conclusion> <ref src="3.112.3"/> </conclusion>
  </valid>
</testcase>

<testcase id="3.113">
  <proposition id="3.113.1">
    <rmrsbankitem id="8">Smith signed two contracts.</rmrsbankitem>
  </proposition>
  <proposition id="3.113.2">
    <rmrsbankitem id="10">Jones also signed them.</rmrsbankitem>
  </proposition>
  <proposition id="3.113.3">
    <rmrsbankitem id="151">Did Smith and Jones sign two contracts?</rmrsbankitem>
  </proposition>
  <valid id="3.113.a">
    <theory> <ref src="3.113.1"/> <ref src="3.113.2"/> </theory>
    <conclusion> <ref src="3.113.3"/> </conclusion>
  </valid>
</testcase>

</testsuite>